id,type,text,stance
35-4,comment1,中国很多政策初心是很好的，但一旦下沉到基层，监管就形同虚设，任由一帮子混蛋瞎搞，所以这个“预制菜”，坚决反对。,against
35-4-1,comment2,那家长监管之前的配餐公司了吗？有相关的知识和能力监管吗？,none
35-5,comment1,如果真要弄预制菜进学校，先让各部门领导吃十年八年再说，毕竟时间短了也看不出效果,against
35-6,comment1,请不要把孩子们当做实验品！预制菜不是神品，只要用上就解决一切问题。请不要神话预制菜！那只能作为辅助食品，不能取代日常一日三餐！反对料理包类的预制菜大量进入校园！孩子是我们的底线！,against
35-7,comment1,央广网评预制菜进校园，是食品安全的提升。瑞幸的一句评论：首先央视食堂试吃。立刻惨遭禁言！,against
35-8,comment1,有道理,against
35-10,comment1,是中央厨房还是预制菜？是当天制作分发的还是加了一堆防腐剂放了几个月的？搞清楚了吗？,none
35-11,comment1,让领导先吃,against
35-12,comment1,预制菜是日本人对我中华的灭种计划,against
35-13,comment1,预制菜就是一种商品，遵循市场规律就行了。为什么要强制吃？,against
35-14,comment1,预制菜的定义到底是什么？冰冻过的生鲜、提前制作的半成品、还是提前做好的冰冻成品？,none
35-15,comment1,支持单位食堂带头，单位食堂一荤一半荤两素一汤，营养不要太均衡哦，到孩子这里就要吃预制菜了？真的说不过去！,against
35-16,comment1,说的核酸大王整的,against
36,background,#比预制菜更可怕的现做菜# 搞这个热搜第一？？？ 谁又发明了一个“现做菜”的名词？？？ 望周知，“预制菜”这个名字，不过才被发明出来几年。 但预制食品由来已久：方便面是预制食品、西餐快餐店里的汉堡、披萨、薯条都是预制食品、火锅底料也是预制食品！ 往远了说，豆腐都是预制食品！ 在没有预 ​​​,none
36-1,comment1,新闻学魅力时刻.jpg,none
36-1-1,comment2,我觉得是微博平台不做人，新浪热点新浪财经，平台自己账号就经常断章取义造谣,none
36-1-2,comment2,这种YXH，也别那啥新闻学了,none
36-1-2-1,comment3,但真的不得不承认，这种未经调查先发文的行为真的很多传统记者越来越少，或者说不是越来越少而是话语权越来越轻。,none
36-1-2-2,comment3,准确来说，传播学就是新闻学，一切营销号都是自媒体。,none
36-1-2-3,comment3,新闻学也挺无辜的，现在谁路过都得踩一脚就是心疼认真传播内容的媒体人,none
36-1-2-4,comment3,跟新闻学没关系，跟微博平台有关系，微博刚被爆热搜黑产没多久吧，它到底整改了啥,none
36-2,comment1,再不管管热搜这群营销号，迟早给你整个大的。,none
36-2-1,comment2,臭狗,none
36-2-2,comment2,诶嘿您猜怎么着，微博也是发布媒体之一哦,none
36-2-3,comment2,我说你俩凑不出一个完整的媽，你们没意见吧？,none
36-2-4,comment2,王高飞要是有户口本早就从根源整治微博自媒体了，可惜他没有。,none
36-2-5,comment2,夹总亲爹,none
36-2-6,comment2,都是他养的好吧,none
36-2-7,comment2,这可是它衣食父母之一,none
36-2-8,comment2,高夫最喜欢大的了，高夫每天都翘臀企盼着大的。,none
36-2-9,comment2,没事，多发爱看,none
36-2-10,comment2,来钩就是推手，,none
36-2-11,comment2,那是它亲爹，它敢管嘛,none
36-3,comment1,“自家现做菜，厨柜里就只有盐、糖吗？”你还别说，我爸做饭确实只有酱油和盐 嘴上说抵制这个那个，出去吃饭还是得吃猛搁味精宽油各种佐料的菜才香,none
36-3-1,comment2,我儿说我做饭比他爷爷和姥姥做得都好吃 。废话， 我师出两位老人 ，再加上我放味精， 能不好吃吗,none
36-3-2,comment2,橱柜只有盐和糖的那是英国人,none
36-3-3,comment2,你好，家里厨柜里有：盐，味精，鸡精，胡椒粉，辣椒粉，十三香，豆瓣酱，甜面酱，黄豆酱，芝麻酱，辣牛肉酱，蘑菇酱，老抽，生抽，白醋，米醋，黄酒，香油，耗油，豆油，花椒油，干辣椒，八角碎，黑胡椒汁，咖喱块，蓝莓酱，芝士。,none
36-3-3-1,comment3,你橱柜里的这些，也全是预制调料。,none
36-3-3-2,comment3,我家橱柜里的调料除了你列出的这些还多出几样:番茄酱、油咖喱酱、沙拉酱辣酱油、苹果醋、寿司醋……，光辣椒就有干辣椒、辣椒粉、辣椒碎、糊辣子、剁辣椒、黄灯笼椒酱、麻辣酱、辣椒油，烹调油有花生油、玉米油、色拉油、调和油和香油。更别提各种香料了，满满一抽屉的瓶瓶罐罐。,none
36-3-3-3,comment3,民间大厨我以为四川不太喜欢芝麻酱的。不过怎么没有白糖,none
36-3-3-3-1,comment4,白糖黄糖红糖冰糖放冰箱,none
36-3-3-3-1-1,comment5,小当家去考试都要管你借调料,none
36-3-4,comment2,我只有盐、醋，还有酱油、芝麻油,none
36-3-5,comment2,真实了,none
36-3-5-1,comment3,我妈做饭只有蒸，盐巴酱油特别是味精都不加,none
36-3-5-1-1,comment4,那能好吃吗,none
36-3-5-1-1-1,comment5,这就是为什么我恨极了辛吉飞的原因,none
36-3-5-1-2,comment4,盐都不加吃啥啊，野外生存都得摄入盐,none
36-3-5-1-2-1,comment5,盐巴只加一丢丢，死不了人的那种,none
36-4,comment1,我觉得站长没说到点上，大家抵制排斥的原因在于，“商家让我误以为这东西是，文火慢炖 费时间 费精力做出来的”我才肯付那个价格。 如果商家明确说我是预制菜，或者我是浓汤宝做的大骨汤。我也能接受，但我只会给我认可的价值。,against
36-4-2,comment2,这些热搜里的“大家”明显不是啊,none
36-4-3,comment2,最开始是你说的这个，但当科技与狠活火了以后，就不再是这点了,none
36-4-3-1,comment3,确实，将做菜污名化成各种化学添加剂了,none
36-4-3-1-1,comment4,别说调料了，40天出栏的白羽鸡都天天被污名化说是激素鸡,none
36-4-4,comment2,建议看看热搜里的视频，再看看我的全文，然后咱们再讨论,none
36-5,comment1,搞食品的人心好累！,none
36-5-1,comment2,特别理解,none
36-7,comment1,站长你是学什么的，农业类还是新闻传播类,none
36-7-1,comment2,播音,none
36-8,comment1,我就一直没搞懂炒作预制菜不安全的是咋想的，还能有你家万年不洗干净的铁锅更脏吗,favor
36-8-1,comment2,我要不是一吃预制菜就拉肚子就真信你了,against
36-8-2,comment2,还真有，小作坊的生产现场绝对比家里厨房脏。,against
36-8-2-1,comment3,那不是预制菜的问题，那些地方即使“现炒”也很脏。,favor
36-8-2-1-1,comment4,是你在比肮脏的。光说食品安全问题，预制菜企业也比不得过五星级酒店的厨房。不论规模形式，光比较是没意义的。,none
36-10,comment1,相信不久就会出来“水是剧毒”了,favor
36-10-1,comment2,有没有一种可能平时家里用的自来水都是净化后的水  也是科技狠活,none
36-12,comment1,他们直接喝西北风吧,none
36-14,comment1,狐主任打人.gif,none
36-15,comment1,就事论事，预制菜出现很久了，涉及多种食材和多方面，主要是为了方便快捷。只要干净卫生符合国家标准规定，并没有任何可吐槽的地方。近两年有些人从网上得知预制菜后，大肆贬低预制菜，妖魔化预制菜。这是不可取的。提个问题：罐头、腊肉、腊肠和腌制品算不算预制菜呢？,favor
36-15-1,comment2,干净卫生？我每次吃预制菜都拉肚子，你说这叫干净卫生？就算你现在肠胃好，长期吃也受不了知道吗？被它慢慢弄坏了身体你就开心了？已经有人用切身体验告诉你它的危害了，你还在侥幸,against
36-16,comment1,还是吃太饱,none
36-18,comment1,张雪峰是对的.jpg,none
37,background,外卖如果都是预制菜，你还会吃吗？？  ​​​,none
37-2,comment1,很多连锁加盟店都采取中央工厂生产冷链送货，门店加热的模式。为的就是保证出品品质统一。其实一早都有了。我都不明白为什么突然间预制菜就成为了洪水猛兽。其实在生活中，像午餐肉，豆豉鲮鱼等等的罐头食品都是预制菜。,favor
37-2-1,comment2,有些是半成品，比如肯德基麦当劳这种半成品，需要门店现场再加工。还有些是预制菜，直接加热就行了,none
37-2-1-1,comment3,就像麦当劳，肯德基的半成品他都有添加剂，防腐剂，这和成品有何区别呢？,favor
37-2-1-1-1,comment4,想你这样说，面粉大米都有添加剂，现做的健康程度和预制菜一样了嘛？ 做熟了，或者水分含量大了更容易变质，添加剂肯定也不一样。,against
37-2-1-1-1-1,comment5,只要是符合国家标准的就是安全的，现在的人就是一提到预制菜，就像洪水猛兽一样。不管你合不合格，就是一顿喷。就像现在学校统一配餐的预制菜。只是当天提前在中央厨房做好，然后分配到学校加热而已，这样的也有人喷。,favor
37-2-3,comment2,不明白可以去高速服务区体验生活，两天就行。,none
37-2-3-1,comment3,靠谱的中央厨房比大部分小餐馆卫生健康多了,favor
37-2-3-2,comment3,03年考的大车证。之后跑了几年的广州到北京的长途货运。我不觉得高速服务区上面的快餐有什么问题。,favor
37-2-3-2-1,comment4,您多吃，别想着让我们吃啊。,against
37-2-4,comment2,因为预制菜防腐添加剂太多，你也不天天吃午餐肉和罐头吧？但是如果不做饭，外卖可是要天天吃的,against
37-2-4-1,comment3,预制菜很少加防腐剂，保鲜最多几天。,favor
37-2-4-2,comment3,你点外卖可以点拉面，河粉这些现做的不就行了吗？,none
37-2-4-2-1,comment4,那也太对付了，就想吃饭吃肉吃青菜,none
37-2-6,comment2,那不是因为送到学校给孩子们吃才引发大量抵制的吗？？,against
37-2-7,comment2,只要符合质量安全标准就没问题，我觉得倒比用地沟油下脚料之类的强,favor
37-3,comment1,总比地沟油啥的做出来的好吧。,favor
37-3-1,comment2,你怎么知道不是地沟油呢,against
37-3-1-1,comment3,那你怎么知道是呢,favor
37-3-1-1-1,comment4,那你多吃,against
37-3-2,comment2,你怎么知道不是么？,against
37-4,comment1,人家也没违法啊,favor
37-4-1,comment2,连胶袋一起加高温！有病才吃……还不违法！？,against
37-4-1-1,comment3,您老知道pp材料的塑料么？耐热的,favor
37-4-1-2,comment3,别逼得和的出来丢人了  很多卖预制菜的都是要求这么做   你能想到的人家想不到嘛  山炮,favor
37-5,comment1,如果按照国家食品安全标准是可以放心食用的,favor
37-5-1,comment2,嗯，你多吃,against
37-6,comment1,预制菜没问题呀，为啥对预制菜那么大意见？没文化,favor
37-7,comment1,现在觉得麻辣烫相比还算健康的了，至少都是现煮,against
37-9,comment1,起码二十年前去快餐店就发现他们用的是预制菜包了。,none
37-10,comment1,不是预制菜的话。点餐高峰期你两个小时都吃不上,favor
37-15,comment1,要么饿着，要么吃,none
37-17,comment1,你想吃就买，不想吃就不买，预制菜又不犯法,favor
37-19,comment1,符合食物安全的怕什麼？不要被營銷號帶偏..,favor
38,background,预制菜你能接受吗？  ​​​,none
38-1,comment1,混淆概念……,none
38-1-1,comment2,中国是预制菜生产大国，罐头，但是人均吃罐头的量在世界范围里不高,none
38-1-1-2,comment3,国外吃罐头才多，中国对罐头天生不爱。,none
38-2,comment1,这是在偷换概念,none
38-3,comment1,我觉得自热火锅算预制菜，正常火锅不是。老干妈之类的是算调味料。这个人想法很偏激，吃不吃是选择，没有生活离不开的问题。,none
38-3-1,comment2,你们反对预制菜的就不偏激？,favor
38-3-1-1,comment3,反对的不是预制菜进校园吗？你愿意你家孩子天天吃那玩意,against
38-3-1-2,comment3,不反对，但反对宣传，然后别让人看到你全家不吃预制菜。,against
38-5,comment1,咸货干货和预制菜是两个概念,none
38-6,comment1,一句踏马的，你怎么有脸说别人骂人?偷换概念，胡搅蛮缠。,none
38-6-1,comment2,素质低下，运气好混到退休了,none
38-7,comment1,火锅底料不就是预制的吗,none
38-7-1,comment2,那是调料，像这样偷换概念的话那盐味精酱油醋也成了预制菜了。,none
38-7-2,comment2,那是佐料。,none
38-9,comment1,呸渣男,none
38-10,comment1,大爷说的透彻，但不是有什么好处，而是趋势。,none
38-12,comment1,你放屁吧,none
38-13,comment1,知识分子,none
38-14,comment1,辣椒酱啥时候归类为预制菜？ 那酱油算不算？,none
38-15,comment1,鱼丸和腐竹这些算是半制成品，不是预制菜。,none
38-16,comment1,预制半价工、预制菜成品,none
38-17,comment1,食材与预制菜两码事儿吧？混淆视听,none
38-18,comment1,口音正确,none
38-19,comment1,这人养老金发太多了,none
38-20,comment1,偷换概念！市场上有预制菜，但成年人可以选择吃可以选择不吃，火锅不吃我自己在家买新鲜肉吃就行了。人家反对的是预制菜进学校，幼儿园小学这种进了小孩还有得选吗？喷的希望你小孩天天吃！,none
39,background,你的人生都被预制了，还在意那盘预制菜吗？  ​​​,none
39-2,comment1,这个……你要是说那种炖排骨烧牛肉正常做要一个小时，预制一下节省时间我能理解！地三鲜？青椒茄子土豆？配菜师傅切好，过油炸！葱蒜炝锅炒加勾芡出锅！正常饭店猛火灶炒撑死3分钟出锅！这好像不怎么需要预制！而且地三鲜要的就是土豆茄子过油炸过得焦香！你预制放那么久一吃就能吃出来吧？,against
39-2-1,comment2,举个例子而已，有必要那么较真呢？听懂得了呗,none
39-2-1-1,comment3,不是较真啊？明明正常制作3分钟就能好的菜被举例说成要1个小时才能出餐？那是不是可以理解成出餐快的都是有问题呢？你有没有想过这让那些正常经营的餐馆小店怎么办呢？,none
39-2-1-1-1,comment4,你觉得3分钟能好？洗菜切菜算进去了吗？你吃的黄焖鸡3分钟就能好，你自己在家炖个鸡试试,none
39-2-1-1-1-1,comment5,我朋友就是酒店大厨！这菜从下过到出锅3分钟戳戳有余！你是不是不知道地三鲜是啥菜？土豆茄子炒辣椒！你这三样菜自己在家清洗去皮切块要不要的了5分钟？更何况饭店都是单独备菜！一次性备很多的！大厨取啥用啥！,none
39-2-2,comment2,关键店家觉得这样成本低，效率高,none
39-2-3,comment2,一个举例子，犯不上非要较真地三鲜，就那么一说意思明白了就行,none
39-2-5,comment2,大叔说了，味道差点而已，，，就是现在的科技发达，很东西我们的眼睛味觉已经无法分辨它是不是真的我们想的那样发展了。,none
39-2-7,comment2,他的意思估计还包括洗菜去皮吧,none
39-3,comment1,我抓住大叔说的一个点，就是一个“东西”经过加工成为一道菜，就让我想起了纸壳也能做小笼包，这就太可怕了，说不准我们人民吃的食物之后放了添加剂没准连有机物都不是了。真的！,none
39-3-1,comment2,纸壳小笼包早就被证实是假新闻了。,none
39-3-1-1,comment3,那我就放心了,none
39-3-2,comment2,在大环境我们只能被迫被动去选择各种食品，蔬菜没有蔬菜味，肉没有肉味，什么都是迅速出栏，说好听的是我们饿不到了，说难听点我们都是被被动的,against
39-3-2-1,comment3,你可以主动饿死，工业化的初衷是为了满足大量人口的钢需，是满足大多数人从无到有,favor
39-3-2-1-1,comment4,现在你饿死了？,against
39-3-2-1-1-1,comment5,我为什么要饿死？我没钱就买平价食物，有钱就买好吃的食物，但是我不会饿死，是因为工业发展，不是用爱发电,none
39-4,comment1,主要是预制菜没有标准，方便面和肯德基麦当劳都有标准化,against
39-5,comment1,我拒绝预制菜！,against
39-6,comment1,别说预制菜我小时候就光吃咸菜吃到初中，而且是一周炒一次带去学校吃一周，每顿都是冷的，只有米饭热,none
39-6-1,comment2,是的 那时读书都是带菜 条件好一点里面放肉炒酸菜 冬天一吃就一周,none
39-6-1-1,comment3,你也是这样啊，太苦了，回想起来都可怕,none
39-7,comment1,通过疫情，我相信很多人相信资本的力量,none
39-7-1,comment2,官商勾结，预制菜进学校食堂都能被写入官方文件,against
39-8,comment1,急眼了是因为给小孩子吃了,against
39-9,comment1,隔夜菜都说不能吃，还预制菜,against
39-10,comment1,重点：“一个东西……”嗯 被动的早就吃过了！,none
39-11,comment1,听说歪嘴光头出事了，不知道是不是真的，你可别出事,none
39-12,comment1,早就已经是自己做饭比上馆子贵的情况了,none
39-13,comment1,添加剂多放哈,against
39-14,comment1,悲哀,against
39-15,comment1,给娃吃不急眼？,against
39-16,comment1,我记得小时候叫“一烹得”,none
40,background,推广预制菜这个事，让我想起了电影《雪国列车》。 最底层车厢的人，吃的只有蟑螂加工制作的蛋白糕果腹，而中层的人吃的是正常食物，上层的人吃的是健康珍贵的食物。 可以预见的是， 未来食品价格会越来越高，新鲜的菜肉水果价格会越来越贵， 吃会变成生活成本里非常昂贵的难以负担的一笔开销。 再加上9 ​​​,none
40-2,comment1,在2019年的时候，就有人预测说未来食物变成人们消费不起的东西，当下能吃到的都是赚到。人们会花费高几倍的价格去购买现在随处可见的食品，我们开始都是不相信，结果就是不论主动还是被动的，未来会逐渐往这方面发展了~,favor
40-2-1,comment2,就是房子会变便宜，食品会变贵？,none
40-2-3,comment2,kk预测吧。,none
40-2-3-1,comment3,不是的,none
40-2-4,comment2,农村人都自己种自己养，难道农村人不是底层人？,against
40-2-4-1,comment3,现在有大企业去农村收地，年轻人不愿意种地把地卖了还有钱拿他们都挺愿意的，以后搞不好会被大企业垄断（我在湖北农村亲眼见到的变化，理性探讨,none
40-2-4-1-1,comment4,土地流转不是这个流程,none
40-2-4-1-2,comment4,耕地只给农民承包，农民也是从国家那里分的，最终所属权是国家的，包括宅基地都只能村内流通，不然买卖无效懂吗？,none
40-2-4-3,comment3,可是以前农村也种地，大饥荒的时候还是饿死那么多人。种出来了自己能留吗？能留多少可不是农民说了算啊,none
40-2-4-3-1,comment4,为什么自己种不能自己留。。你这观念还是多少年前的啊。。,none
40-2-4-3-1-1,comment5,房子还是你的呢，疫情时候征用你看你还能不能在里面住,none
40-2-4-3-2,comment4,麻烦你去了解一下历史，具体看看什么原因造成的饥荒，还有现在种地不但不交粮还有补贴,none
40-2-4-3-2-1,comment5,后面地还是不是你，你可能还没反应过来，看着吧，会来的,none
40-2-4-3-2-2,comment5,哈哈哈，真巧，我就是学历史的。所以你认为粮食和菜普遍涨成天价的时候普通老百姓还能吃的饱睡得好？你也太理想化了吧。而且你也太小看国家实力了，没人种的地一声令下就能变成有人种的地，只不过种出来的东西到谁手里？有多少到手里才是问题好吧,none
40-2-4-3-3,comment4,那个年代饥荒是自然灾害，国家信息闭塞，地方欺骗中央，没有调控好吧。现在农村的地根本没人愿意种，你了解一下实际情况再说话吧，因为买很便宜，种地很累。,none
40-2-4-4,comment3,……我没看明白你的回复，我也没提到农村人和底层人啊……是不是回错评论了……,none
40-2-5,comment2,曾仕强的预言吗,none
40-2-5-1,comment3,不是不是～姑妄听之,none
40-2-6,comment2,现在2023年食品价格比2019年都明显贵了不少,none
40-2-6-1,comment3,米面贵了吗？猪肉贵了一点，那是以为猪瘟还没缓过来,none
40-2-6-2,comment3,那位预言家说会持续十年，现在想来这心里拔凉拔凉的啊……,favor
40-2-6-2-1,comment4,先苦后甜也不是不行,none
40-2-6-2-2,comment4,到2029年么？那还有6年是不咯,none
40-2-6-2-2-1,comment5,大约2027年往后会好一点，更准确的说是到2047年变好很多~,none
40-3,comment1,我只希望能明确告知我哪些是预制菜，至少让我有个选择,none
40-3-2,comment2,那些自热米饭都是预制菜,none
40-3-2-1,comment3,但并不便宜,none
40-3-4,comment2,一堆糊糊稀稀拉拉的一般都是,none
40-3-5,comment2,食物原型你总认得吧。。。,none
40-3-5-1,comment3,饭店吃饭分不清啊，外卖也不知道，,none
40-3-5-2,comment3,有些外卖可能是预制菜，但我认不出来,none
40-3-7,comment2,我同意标明哪些是预制菜，然后大家发现预制菜并没那么可怕，早就吃了好几年了,favor
40-3-7-1,comment3,平时可以在网上买到小区自提的基本都是预制食品,none
40-4,comment1,还有人造肉呢，以后底层连真肉都不配吃,favor
40-4-1,comment2,一些大学里就全是科技肉,none
40-4-2,comment2,再发展下去 科幻文里的营养液就要出来了 以后喝营养液吧,favor
40-4-2-1,comment3,我小时候看的报纸就提倡过可以吃各种维生素药片，就不用吃饭，不知道有没有人记得.以前的维生素是上电视广告的，很多补剂,none
40-4-2-2,comment3,朋赛博克那味就来了，科技没到那地步阶级先扯开了,none
40-4-2-3,comment3,有啊，“若饭”，就是价格还是太高，买的人不多,none
40-4-3,comment2,现在就一堆科技肉，网上很多宝妈分享生活，给孩子吃的是10元牛排，那不就是科技牛排吗北京外边的餐厅，人均200元的，一般是预制菜，一半是科技肉。菜市场便宜的肉，那个肥牛都是科技肉。,none
40-4-3-1,comment3,山姆买牛排自己煎，价格还好，去外面吃那可就贵了,none
40-4-3-3,comment3,全国大部分小朋友能吃上预腌胶水牛排算很好的了，不少地方连像样的肉都吃不上。就像pdd老总说的，让三四线家庭能用上便宜的厨房纸巾是消费升级,none
40-4-3-4,comment3,我们小区家长就团购十几块的牛排还说好吃1976年的法国电影《美食家》路易·德·菲耐斯（虎口脱险主演），里面的蔬菜就是科技手段造出来的。,none
40-5,comment1,食品价格不会变高的除非水电煤一起涨价。唯一的问题就是上面有人入股了预制菜,against
40-5-1,comment2,上面的姐姐喷完还把我拉黑了 我只能回这里了 好吧 主要我也没去过costco 我只能说wholefoods菜水果都好贵 costco确实鸡蛋和肉便宜很多但是我朋友说不好吃 可能是品质不行 我补充一下 应该说美国品质好的蔬菜水果贵  肉（包括品质好的）是便宜,none
40-5-2,comment2,说真的，我们这天然气和电费都涨了,none
40-5-2-1,comment3,哎再苦一苦百姓,none
40-5-3,comment2,今年明显感觉到水果变贵了,none
40-5-3-1,comment3,水果贵可能是运费贵了 毕竟油价涨了,none
40-5-3-2,comment3,水果这三年有便宜？苹果以前2.8现在5块起步,none
40-5-3-2-1,comment4,我昨天超市买的苹果，10块多一斤。旁边有5块多的，有8块多的，有14块多的各种苹果，我选了个居中价位，口感一般，3个苹果都18块多,none
40-5-3-2-1-1,comment5,洛川源头么说只有1_2块钱到上海最便宜的也才5块钱我tm这几年都不敢吃苹果了,none
40-5-3-2-2,comment4,有些今年明显又涨价了,none
40-5-3-2-3,comment4,上海真的太贵了我们这现在阳光玫瑰5块钱一斤,none
40-5-3-2-3-1,comment5,我这9.8还是郊区,none
40-5-4,comment2,别的不说，今年水果也太贵了,none
40-5-4-1,comment3,榴莲玫瑰青提便宜了，其他的通通贵了，买了四根香蕉六个橘子28给我惊呆了，关键橘子还不好吃，寡淡如水,none
40-5-4-1-1,comment4,是的，贵价水果在便宜，但是普通水果在涨价。奢侈品都在便宜，基本用品在涨价，诶,none
40-5-5,comment2,食品价格一直高位相对于收入来说，特别是中国人喜欢讨论菜价很说明问题，你听过哪个西方人成天探讨西瓜多钱一斤吗,none
40-5-5-1,comment3,国内的蔬菜水果价格真的可以说世界最低了  美国日本韩国蔬菜水果价格和他们当地收入比都是很高的了,none
40-5-5-1-1,comment4,你不要以中国人的收入去对比发达国家菜价。要以当地人中位数收来看。如果你觉得美国菜贵可能是自己挣少了。非常合理。美国人不觉得贵我很少看到美国人在tiktok吐槽。人家真吃不上会去游行抗议拉横幅办法多的是。老中能吃苦就再吃点玉米面呗……,none
40-5-5-1-2,comment4,国内收入到是世界最低，所以相比之下生活物价就高，恩格尔系数说明一切。并不是嘴硬就有用,none
40-5-5-1-3,comment4,？你在搞笑吗 去看看120刀Costco能买多少吃的 再看看120人民币能买什么,none
40-5-6,comment2,食品价格怎么不会变高，想想五年前十年前是什么价格,favor
