id,type,text,stance
117-17,comment1,工业流水线上的东西肯定比现做的干净啊，只要生产源头把控，统一生产配送集中供应，说实话工业流水线的产品只要把价格压下来别的无所谓，手工炒一份20，那么流水线就一份10块。,favor
118,background,非常反感预制菜，也反对预制菜进校园。 1、吃过一些预制菜，觉得预制菜的味道口感真的很差，偶尔吃一顿还能接受，但是要顿顿吃的话简直让人腻到吐，成年人都受不了，更何况是青少年儿童。 2、预制菜相比于现做的菜，不仅是口感味道差，由于需要批量提前做好然后较长时间的储存、运输等流程，会涉及食物变质、营养流失等问题，在营养健康、安全性方面，都存在风险。 3、学校给学生吃什么食物、饭菜，是需要告知学生家长并取得同意的，如果没经过家长同意，仅仅为了自己省事方便、节约成本，就给孩子吃预制菜，那这是损害了学生家长们的知情权。 4、吃现烧饭菜本来就是正常不过的事情，而预制菜属于方便食品，是为了给不会做饭和没时间做饭的人准备的，现在居然能进入学校和食堂进行大规模代替现做饭菜，也真的是很离谱。 #央广网评预制菜进校园#,against
118-1,comment1,你觉得学校食堂可以使用预制菜给孩子们吃么？,none
118-1-1,comment2,不可以，坚决抵制,against
118-1-2,comment2,太难吃了,against
118-2,comment1,感觉老师指的是料理包而不是预制菜我之前买过预制菜是把原料加工到下锅前一步，然后自己下锅炒的，比如肉是生的但切好了，蔬菜是洗过的也切好了，酱料比例也调好了，就等自己下锅炒,favor
118-2-1,comment2,你那是净菜,none
118-2-3,comment2,你说的是净菜。,none
118-2-4,comment2,料理包真的受不了，又难吃又难看，这种准备到下锅前的预制菜一般保质期不长，确实比较省事，不过保质期过长的不能接受,none
118-2-5,comment2,就是预制菜，办公室楼下卖的是预制菜，吃过几次，受不了,against
118-3,comment1,反对预制菜进校园,against
118-4,comment1,反对预制菜进校园,against
118-5,comment1,预制菜营养差,against
118-6,comment1,超级难吃，我都吃不下,against
118-7,comment1,可怕的是学校收费是按现做菜，给孩子吃的是预制菜……,against
118-8,comment1,真的要现炒现吃才可以,against
118-12,comment1,我也觉得不好吃,against
118-15,comment1,我们学校有一次甚至当着我们的面把预制菜的包装打开，加热之后卖给我们,against
118-16,comment1,反对预制菜进校园！学生也有选择权！,against
118-18,comment1,我也抵制预制菜，对于肠胃不好的群体 简直是致命的,against
118-19,comment1,吃新鲜菜,against
119,background,#央广网评预制菜进校园# 话说以前封控的时候在高速口值班，那时吃的全是送来的盒饭，那些应该都是预制菜吧？口感确实不行，难怪家长会有意见，谁希望自家孩子天天吃这个？,against
119-1,comment1,央视农业刚刚发视频。首先不是预制菜。是中央厨房。国家对中央厨房和预包装食品有两个标准有两个。中央厨房的东西不能出售。不同央视水平真不一样只能说,none
119-2,comment1,预制菜是日本传过来的  但为什么日本不给他们的学校吃预制餐呢,against
119-2-1,comment2,如果把罐头食品也算预制菜的话，日本还在明治维新,none
119-2-3,comment2,日本学校也吃预制菜，然后每年无数学校食品安全事故。,against
119-2-3-1,comment3,然后把总出现事故的预制菜引进到中国来    其心可诛,against
119-2-3-1-1,comment4,里面有带辐射的东西就更要命。,against
119-3,comment1,半年前可以先做好，半年后在加热即食 。在家吃不到的隔夜菜在外面随便吃。 ​​​,against
119-5,comment1,一个是新鲜蔬菜的问题，一个是有没有防腐剂和食品添加剂,none
119-6,comment1,小朋友们吃预制菜，不说是天天，起码周一到周五每天必有一顿。。。这种有保质期的玩意，准备让小朋友们这样吃，是怎么样的思考过程才能产生的？？我没有弄明白,against
119-7,comment1,其实我想说，野战部队都要带炊事班炒糖色，把预制菜放进常规市场，到底是为了什么？社会发展的最终意义是圈养？？,against
119-8,comment1,个人感觉预制菜保鲜吗？有各种高科技防腐剂吗？如果能解答这样问题我觉得家长应该会接受的吧，本来吃饭就是要新鲜的饭菜，如果是僵尸饭菜谁都担心吧,none
119-8-1,comment2,保值期一年,none
119-9,comment1,预制菜本身定位就应该比新鲜热菜更次，其价格、新鲜度、风味都不如新鲜菜，以次充好赚差价才是问题所在,none
119-12,comment1,让央广网的食堂先吃个一年后再推广吧,against
119-13,comment1,我小孩学校就有家长反对的，唯一得预制菜就是鸡块，两三周就一次。理由就是她小孩有过敏。。。你们评下吧。。。,none
119-15,comment1,网上舆论都是先射箭后立靶,none
119-16,comment1,盒饭大部分是现做的。,none
119-17,comment1,很多人在混淆预制菜（料理包）跟半成品菜，净菜的概念。,none
119-18,comment1,不吃预制菜怎么能得预制病,against
120,background,#新华社调查预制菜进校园#【#预制菜是否已大规模进入校园#？中央厨房配餐是不是预制菜？新华社调查】开学伊始，“预制菜进校园”引发公众关注。一些家长对预制菜的质量和安全表示担忧。预制菜具备方便快捷等优势，正悄然渗透越来越多消费场景；但与此同时，校园餐食的安全营养不容忽视。如何缓解一些家 ​​​,none
120-1,comment1,【#家长为何反对预制菜进校园#】家长反对预制菜进校园主要集中于两方面：一是质疑预制菜的安全和质量，二是质疑知情权和选择权难以得到保障。不少家长的共识是，在孩子饭菜方面，效率和成本不应作为第一考量。校园餐食更应注重安全营养卫生。#新华社调查预制菜进校园#,none
120-1-1,comment2,一餐15元标准,none
120-3,comment1,资本从来都是血淋淋的…,against
120-3-2,comment2,谁允许的？哪个为预制菜背书站台的？,against
120-3-3,comment2,资本？资本在这里只配当夜壶使。,none
120-3-4,comment2,你也就只敢骂骂资本,none
120-3-5,comment2,资本可没这么大能耐仔细看看中央两个字，资本可注册不了这种商标,none
120-3-5-1,comment3,笑死我了哈哈哈哈，中央,none
120-3-5-2,comment3,中央厨房，不是中央那个，你太搞笑了吧,none
120-3-5-2-1,comment4,不管是什么，中央这两字资本家可注册不了,none
120-3-5-2-1-1,comment5,中央厨房不知道，中央空调你总听说过吧。,none
120-3-5-2-1-2,comment5,中央厨房你都不知道,none
120-3-6,comment2,呆呆，那是资本吗？！背后是官二代三代四代……,none
120-3-6-1,comment3,官还不够，必须得红,none
120-3-6-2,comment3,社资呀,none
120-3-6-2-1,comment4,那叫官僚资本,none
120-3-6-2-2,comment4,什么叫社资？！直接通过行政命令进校园，哪里像资本？,none
120-3-6-3,comment3,官僚资本,none
120-4,comment1,中国本来小孩就不多。这样搞？,against
120-4-1,comment2,小日本换国计划,against
120-4-1-1,comment3,弄半天你连谁在危害你的权益都不清楚,none
120-5,comment1,进校园才有利润，而且是稳定的利润资本好眼光,against
120-5-1,comment2,不是核子可乐？,none
120-6,comment1,机关单位先吃 吃得好了再进校园,against
120-6-1,comment2,让上层看到了，优先把你号删了,against
120-6-2,comment2,我建议部队先吃,against
120-6-3,comment2,好像说的有道理,against
120-7,comment1,从中央部委食堂做起，推广。,against
120-7-1,comment2,尤其是部队，这么讲效率的单位，必须吃,against
120-7-2,comment2,部队也得跟上,against
120-7-3,comment2,好像你说的有道理,against
120-8,comment1,预制菜让成年人吃也就算了，还祸害孩子。一个保质期能一年的东西添加了什么心知肚明。这玩意让孩子天天吃？损不损啊,against
120-10,comment1,预制菜好啊 好东西领导先吃,against
120-11,comment1,三鹿奶粉后就是案例！现在的预制菜能不能从企事业单位开订购预制菜开始！为什么非要从学校开始？只要是有食堂的单位都先开始！别拿祖国的未来做实验！,against
120-12,comment1,从小开始吃防腐剂能长命百岁是吧,against
120-13,comment1,还有未来吗,against
120-14,comment1,最关键的是为什么要强制进入校园？家长学生拿了钱却做不了主！！这跟强奸犯有什么区别？,against
120-14-1,comment2,咱们都明白，新x社不明白,against
120-15,comment1,既然国家为预制菜站台，那就中央部委食堂、机关幼儿园学校先试行。谁推广的谁带头吃，不是偶尔作秀地吃，而是一天三顿一周五天去吃,against
120-16,comment1,如果“不想孩子被迫吃预制菜”，可以向所在地人民代表反馈想法，可以依法申请游行，合规合法的表达意见！,none
120-16-2,comment2,都是有软肋的人，可能做这种事么,none
120-16-2-1,comment3,拘你,none
120-16-3,comment2,啊？,none
120-17,comment1,理论上说，预制菜应该会更加卫生、更加方便控制营养价值和分量才对吧？,favor
120-17-2,comment2,只需要思考一个问题就好了。预制菜保质期为1年，想想怎么做到的,against
120-17-2-1,comment3,冷链啊，而且预制菜有这么多种，并不是所有的保质期都有这么久的。,favor
120-17-3,comment2,卫生个毛线啊，人家上厕所手洗了没有你都不知道,against
120-17-4,comment2,明明可以吃现成的，非要换成预制菜，连选择权都没有，你给我解释解释？,against
120-17-4-1,comment3,有没有选择权又是另外一件事情了，我的观点仅限于我写的那句话,none
120-17-4-1-1,comment4,嗯，在这个理论上，我觉得还有更好的选择，直接喝营养液来的更快，流水线控制好了也能保证安全。,none
120-17-5,comment2,放屁，,against
120-17-5-1,comment3,你这素质可以的,none
120-17-6,comment2,连炒鸡蛋都有现成品，里面能含一半鸡蛋就不错了，剩下的谁知道是什么，肉类为了保持鲜嫩放了很多保水剂，这个对身体的伤害比防腐剂都大,against
120-17-6-1,comment3,半成品肉类里保水剂添加的非常多，没有防腐剂还有其他剂，一日三餐都吃确实非常不放心,against
120-17-8,comment2,卫生 营养含量是可以控制的 但是营养价值相比于等量的新鲜菜品有很大的折扣 添加剂对某些人群也会有不同程度上的不良反应,against
120-17-8-1,comment3,只能说有利有弊了，顾虑大的家长其实也只能选择自己准备饭菜。,none
120-17-8-1-1,comment4,问题是有些学校是强制进校园,none
120-17-8-1-1-1,comment5,如果多数家长都不愿意，学校这么做肯定不妥。,none
120-17-8-1-2,comment4,顾虑大的家长 现炒菜也总有人不会满意的 比如我妈 我做的她都不满意,none
120-17-8-1-2-1,comment5,那怎么办，只能挂营养液了吗,none
120-17-9,comment2,你以为的如此，其实一旦预制菜能够上了学校的餐桌，成本的控制就开始变得非常重要 ，这帮人为了挣钱，能干净卫生健康就怪了。,against
120-17-10,comment2,就中国的监管根本保证不了，里面的菜的质量,against
120-17-11,comment2,那你吃呗,against
120-17-11-1,comment3,我吃啊，现在能吃到预制菜的概率还低么？商场里的品牌餐厅，几乎得有一半以上都是在用预制菜了吧，除非永远自己做，且只去菜市场买菜。,favor
120-17-11-1-1,comment4,你也说概率啰！那进学校了，是百分百了！而且你觉得进学校的和品牌餐厅的是一样品质的吗？,against
120-17-11-1-1-1,comment5,所以关键在于监管嘛，不在于是什么菜。监管不到位，现买的一样可以食物中毒，拉到天旋地转，这些故事也不少了。,favor
120-17-12,comment2,理论上讲是这样，实际上不好说了。理论上宇航员吃的也是预制菜，但这品质就不一样了,against
120-17-13,comment2,你最好给老子闭嘴,against
120-17-13-1,comment3,要做1450也记得要有礼有节，上来就老子老子的，该去哪儿待去哪儿待着。,favor
120-17-14,comment2,张核子进军预制菜，并给你点了个赞,against
120-17-14-1,comment3,谁爱进军预制菜和我毛关系没有，我只谈我的看法。,favor
120-17-14-1-1,comment4,6，因为这跟你的理论相悖。所以跟你有关系,against
120-17-15,comment2,不咋滴。现实中就有22年2月的预制菜出现在23年9月的餐桌上,against
120-17-15-1,comment3,没有预制菜就没有这样的事情发生了？问题的关键是在预制菜上吗？,none
120-17-16,comment2,你相信资本吗？人家只是想发财而已会管你小孩营养不良？,against
120-17-17,comment2,东西都给你打上防腐剂，这就安全了吗,against
120-17-17-1,comment3,只要符合国家规定的产品，我不认为有什么问题。食品科学发展到今天，已经不是初级阶段，运用什么方式保鲜，自然有合适的方法。如果没有按妥善的方式来保存，新鲜的食材一样可以在运输到烹饪的这个过程中出差错。,favor
120-17-17-1-1,comment4,你太想当然了，人家资本家是要赚钱的，你在这说健康科学？？,against
120-17-18,comment2,怎么可能，剩饭剩菜营养流失严重，专家不建议吃剩饭剩菜，预制菜和剩饭本质上是一样的而且时间更长 营养流更失严重,against
120-17-18-1,comment3,你的逻辑太跳跃了，我跟不上。,none
120-17-19,comment2,那得看念经的和尚正念还是歪念～,none
120-17-19-2,comment3,这句话说的有啥用,none
120-18,comment1,让预制菜作为机关单位国企事业单位的饭堂专用吧,against
120-18-1,comment2,就是这才去硬道理,against
121,background,【#你认为预制菜可以进校园吗#？】#为什么家长反感预制菜#近段时间，“预制菜进校园”一事引发广泛讨论，多地家长通过问政平台表达了担忧。不少家长表示坚决抵制，希望官方对预制菜是否进校园给出明确态度。#新华社调查预制菜进校园# ​​​,none
121-1,comment1,难道不应该支持预制菜进机关单位事业吗？让这些老爷们先吃起来。,against
121-1-1,comment2,进了也没用，一份60和一份4毛的预制菜能一样么。。老爷吃60，80的预制菜那比一般厨师做的好的多，学生吃4毛的和食堂一样长毛都是虫。,against
121-2,comment1,预制菜至少要有时间限定，有些都半年以上的预制菜，怎么给孩子吃？还想让孩子健康成长吗？,against
121-3,comment1,谁同意就先让他家的孩子吃两年做试验,against
121-6,comment1,想不通，官方为什么鼓励预制菜进校园？为什么？,against
121-7,comment1,连孩子的食品安全都得不到保障，还想让人生三胎？,against
121-8,comment1,不可以，绝对不行，这是底线,against
121-9,comment1,居然有赞成的，你们没子孙后代吗？,against
121-10,comment1,都用预制菜，学校还招的厨师干嘛,against
121-11,comment1,预制菜就是难吃 滚,against
121-12,comment1,真是的一边说隔夜菜不要吃，一边又放开预制菜，真是绝了,against
121-12-1,comment2,不懂皇亲国戚吗？,against
121-13,comment1,就健康来说，每个人都要健康，不是只有孩子要健康。,against
121-15,comment1,这么说吧 以前公司做预制菜的，老板一家都不吃，也劝我们不要吃,against
121-16,comment1,太讲究时限了，当然不接受了！,against
121-17,comment1,利益驱使！！！,against
121-18,comment1,机关单位先吃呗,against
122,background,【预制菜，能满足孩子们“舌尖上的安全”吗？】#范志红谈预制菜进校园#“预制菜能不能进校园”的争议，有官方回应了。9月22日，教育部有关司局负责人指出，经研究，鉴于当前预制菜还没有统一的标准体系、认证体系、追溯体系等有效监管机制，对“预制菜进校园”应持十分审慎态度，不宜推广进校园。中国 ​​​,none
122-1,comment1,至少机关请带头，把过节福利全换成预制菜,against
122-1-1,comment2,先进机关小学和机关幼儿园呗 都觉得没问题在去公立,against
122-1-1-1,comment3,机关小学和幼儿园现在基本都会从当地片区招生的，非机关的儿童也能报读的。和公立学校没什么区别。,none
122-1-1-2,comment3,我觉得不行，什么学校都不能进！就算全是机关单位的孩子的学校都不行！他们回家吃就行了，底线就是不能进学校,against
122-1-2,comment2,别闹了  机关就算吃的预制菜  那也比进校园的要安全,against
122-1-2-1,comment3,本质就是抵制进学校啊，要是真安全就让他们吃呗，谁出台谁吃,against
122-1-3,comment2,机关带头有什么用，让机关的娃儿带头天天吃,against
122-1-4,comment2,机关本来也不发菜啊,none
122-1-4-1,comment3,把米面油零食饮料超市卡（不知道现在还有没有）蛋糕卡都换成这个。不提劳保已经是我最大的让步,none
122-1-4-1-1,comment4,额我不是机关单位，我们单位不发劳保用品是违规的。,none
122-1-4-1-1-1,comment5,？？？？？？国企什么时候开始不发劳保的，挺奇怪的，我离职的时候明明还有,none
122-1-4-2,comment3,发什么？,none
122-1-4-2-1,comment4,一般都是米面油牛奶啥的吧，还得看看这个机关和那些企业关系好,none
122-2,comment1,预制菜进校园，说白了，是给资本垄断学校食堂，敞开大门。,against
122-2-1,comment2,早就垄断了好吧，开学校食堂的谁不跟校长书记有点关系啊！本来就是那群人在做，只不过把现做变成预制,against
122-2-1-1,comment3,张嘴就来，你们那个城市所有学校的食堂老板是同一个人吗？如果不是，怎么叫垄断,none
122-2-1-1-1,comment4,抠字眼有意思吗？学校食堂多少是裙带关系进去的，没有充分的招标和竞争，学生也根本没有用脚投票的权利，这和垄断有什么区别啊？非得搞个托拉斯才叫垄断吗？,none
122-2-2,comment2,建议先拿机关幼儿园，食堂做试点，试点十年无碍再普及,against
122-3,comment1,隔夜的饭菜，都不安全！隔月隔年的饭菜，还能安全。不过有时候很无奈，,against
122-3-1,comment2,隔夜菜不能保证在灭菌前提下隔绝微生物进入。这是它和预制菜的本质区别。,favor
122-3-2,comment2,我们自己家里做过菜的都知道，菜能放多久，唉，普通人真的无奈,against
122-3-3,comment2,在理，就跟各种加工后的食品鼓吹健康食品的,against
122-4,comment1,不同意，有本事政府机关单位食堂都上预制菜呀,against
122-4-1,comment2,那盒，能装下四菜一汤吗？,none
122-6,comment1,牛逼，谁提出来的，曝光他,against
122-8,comment1,坚决抵制预制菜！,against
122-9,comment1,看看,none
122-10,comment1,对于祖国的未来还是要呵护的,against
122-11,comment1,让范志红全家吃预制菜,against
122-13,comment1,中华人民共和国食品安全法第五十七条   学校、幼儿园、养老院、工地等集中供餐单位的供餐要当餐加工！预制菜进校园是违法行为,against
123,background,#教育部称对预制菜进校园持审慎态度# 我觉得预制菜就不该给孩子吃，他们正是长身体的关键阶段，饮食安全问题必须严格对待 ​​​,against
123-2,comment1,肯德基麦当劳都是预制菜,none
123-3,comment1,实际上 要抵制的是黑心菜 黑心加工厂。好预制菜 为生活增加便利 ，总比单一的方便面 强吧。小包装的口味不错的预制菜 京东  上 卖的也很多的。为什么一进学校质量就不行了 ？在大型连锁餐管就很好那？,favor
123-3-1,comment2,偶尔吃一次和每顿吃一样吗？唉，沟通太难了,against
123-3-1-1,comment3,大酱、土坑酱菜,none
123-3-3,comment2,方便面和预制菜一样是高油的，容易被吃出来慢性病的！正在身体的孩子不适合吃预制菜，这是基本常识！,against
123-4,comment1,让领导先吃，机关先吃行不行，总是赚些黑心钱，没大的韭菜都要割，恶不恶心,against
123-4-1,comment2,航天员还吃预制菜不知道吗,favor
123-4-1-1,comment3,航天员的预制菜和给屁民的能一样？但凡吃的航天员不舒服一点都担责完蛋,against
123-4-1-1-1,comment4,屁民这个词和“滞纳”一样是属于极其恶毒的反华用语！,none
123-4-1-3,comment3,又来？预制跟预制是一样的吗？！,against
123-4-1-3-1,comment4,你说那？那个产品不是航天技术发现的,none
123-4-1-3-1-1,comment5,对，航天员吃的那个是预制菜，可到老百姓手里的就是类似方便面的预制菜了。,against
123-5,comment1,恕我直言，预制菜可能比某些学校食堂还干净,favor
123-5-1,comment2,恕我直言，有些预制菜可能比猪食狗食都不如！,against
123-5-1-1,comment3,是啊，但是为啥要一棒子打死？规范安全卫生有营养的流程是正题啊，我们学校满食堂都是蟑螂蛞蝓做出来的东西你敢吃嘛,favor
123-5-2,comment2,怎么品质越来越低呢？为啥不想着把食堂做好呢,against
123-5-3,comment2,虽然我高中食堂确实逆天，但我初中和大学都吃的很好 预制菜就把上限锁死了,against
123-5-4,comment2,是的，饭堂做的真不一定干净卫生，我吃过一次鸡肉都是散的，天知道冷藏了多久,favor
123-5-4-1,comment3,你凭啥认为预制菜就不是冷藏的？ 成本三毛的油条，卖你三块，比现做现炸的还贵。你怎么看？,against
123-5-5,comment2,智障吧你,against
123-5-6,comment2,叫你孩子天天吃吧。,against
123-5-7,comment2,怎么这么多洗预制菜的，以前都没听过呀,against
123-5-8,comment2,保质期一年的预制菜你吃么,against
123-5-8-1,comment3,保质期几年的大米 盐 糖 酒没见你不吃保质期得当的情况下保质期很长的冻货没见你不吃,favor
123-5-8-2,comment3,那建议保质期超过一年的食物你都别吃,favor
123-5-8-3,comment3,相比于我们高中的食堂环境我可以天天吃,favor
123-5-9,comment2,希望你全家能天天吃,against
123-5-9-1,comment3,那你吃过你无全家,favor
123-5-9-2,comment3,不能一概而论，如果是那种几年前做好的预制菜不能接受，但如果是萨莉亚这种中央食堂预先做出的半成品菜应该还能接受,none
123-6,comment1,第一，预制菜不代表不安全，宇航员全部吃的预制菜，第二，厨师现烧不代表安全。各种食物中毒发霉食材总不能都是预制菜吧。,favor
123-6-1,comment2,首先，宇航员有多少人？他们吃多久？其次少而精 ，品控可以做好；但大规模生产时能有宇航员预制菜的品控？,against
123-6-1-1,comment3,大规模就做不好了？别用脚趾头当大脑好么。笑死了。,favor
123-6-1-1-1,comment4,不用争，你可以去试试，天天预制菜。,against
123-6-2,comment2,拉倒吧，就中国这种食品安全没人监管的状态，腐肉烂菜添加剂才是预制菜的常态,against
123-6-3,comment2,第一，预制菜不代表安全，宇航员吃的跟别人吃的能一样？第二，厨师现烧不代表不安全，况且厨师烧菜是否安全不是你推广预制菜的借口！懂不懂？,against
123-6-3-1,comment3,肯德基几乎都是预制菜，怎么没有见你抵制？,favor
123-6-3-1-1,comment4,肯德基那是本成品吧，跟预制菜还是有区别的,none
123-6-3-1-1-1,comment5,所以洋人的预制菜就不是预制菜了？,none
123-6-3-2,comment3,所以凭什么不准推广？靠你的张口就来？,favor
123-7,comment1,我家孩子明年高中，就要住校了，我也坚决反对预制菜。,against
123-8,comment1,今年大运会工作人员餐饮保障就是用的预制菜，那都不能叫难吃了，要是没有老干妈，早特么饿死了。,against
123-9,comment1,这要看谁的预制菜，以及什么标准的预制菜，不能一棒子打死。如何来定义预制菜。提前把菜都处理好，只需要学校进行最后的烹饪算不算预制菜？ 再进一步，给你做好，只需要进行加热就可以，算不算？ 而且高标准的预制菜，品控是难以有老鼠的,favor
123-9-1,comment2,归根到底是食品安全监管不到位，换成预制菜只会越来越糟糕！居然说预制菜能改善安全，简直是笑话,against
123-10,comment1,预制菜分为四大类：即食（如八宝粥、即食罐头）；即热（如速冻汤圆、自热火锅）；即烹（须加热烹饪的半成品菜肴）；即配（如免洗免切的净菜）。这么一看 预制菜的范围挺广的 没有办法避免啊,favor
123-10-1,comment2,我们这里说的预制菜主要是狭义的预制菜，是指加工好的成品炒菜，加热之后就可以直接吃这种，不管是用微波炉还是水煮，还是倒出来再重新炒一遍，比如说宫保鸡丁鱼香肉丝，这种预制菜你说的广义的不在我们讨论的范围之内,none
123-10-1-1,comment3,就料理包呗？,none
123-11,comment1,让教育部的食堂先吃一年预制菜后开始再推广吧,against
